{"baseline_digest":"b6195ed38de447e45b21a353ecc8b7d1157c0aae32bbe2ee2ba6a3dcd4d49a7b","baseline_id":"example-fedora44-x86_64-v1","builder_image_digest":"sha256:6666666666666666666666666666666666666666666666666666666666666666","dracut_config_sha256":"1e5b8ccebefad4e6e129b8130e224d80d9766498e3d7aecd3465eac293f64619","kernel_config_sha256":"f82dbfebf40a1503127317bdb60fcec38d802bf00752e2be14ec06b0458f1b4d","kernel_srpm_sha256":"ec1ef238c568d56312345df7d431eac630f592dc7ac808427d0ef82f93310143","layout":{"experiment_mib":32768,"factory_size_mib":4096,"library_mib":32768,"log_budget_mib":4096,"root_mib":2048},"policy":{"firmware_writes":false,"internal_storage_access":false,"recovery_selinux":"disabled","root_read_only":true,"secure_boot":"disabled"},"recipe_id":"generic-recovery-v1","recovery_fragment_sha256":"703a370d7b5c711f574145508f3b54e020d87edb861d8789b4c16716a8484bea","rootfs_lock_sha256":"397baf4c422dd23a6500db3acac3680c660289669fc06c786fb32de112b47d1b","runtime_revision_sha256":"e654142d62dd5a07b1ffb6b3e8f2f67fc6da6f4331ef821d1c690a3b1fbeaa11","schema_version":1,"source_date_epoch":1700000000,"unit_allowlist_sha256":"5b8c6eb11bb275deb63ba62f1596e2874a35ca7555ed2f546f7ef1ac9ed8a30c"}